{
  "$schema": "https://json-schema.org/draft/2020-12/schema",
  "$id": "https://serialos.local/schemas/content-brief.schema.json",
  "title": "ContentBrief",
  "type": "object",
  "additionalProperties": false,
  "required": [
    "topicId",
    "columnId",
    "audience",
    "oneSentencePromise",
    "thesis",
    "objectives",
    "keyPoints",
    "structure",
    "mustUseAssets",
    "mustAvoid",
    "claimPlan",
    "formatPlans",
    "knownLimitations",
    "artifact"
  ],
  "properties": {
    "topicId": {
      "type": "string",
      "format": "uuid"
    },
    "columnId": {
      "type": "string",
      "format": "uuid"
    },
    "audience": {
      "type": "string",
      "minLength": 1,
      "maxLength": 500
    },
    "oneSentencePromise": {
      "type": "string",
      "minLength": 10,
      "maxLength": 300
    },
    "thesis": {
      "type": "string",
      "minLength": 10,
      "maxLength": 1000
    },
    "objectives": {
      "type": "array",
      "minItems": 1,
      "maxItems": 8,
      "items": {
        "type": "string",
        "maxLength": 300
      }
    },
    "keyPoints": {
      "type": "array",
      "minItems": 2,
      "maxItems": 12,
      "items": {
        "type": "object",
        "additionalProperties": false,
        "required": [
          "point",
          "purpose",
          "assetIds",
          "sourceIds"
        ],
        "properties": {
          "point": {
            "type": "string",
            "maxLength": 800
          },
          "purpose": {
            "type": "string",
            "maxLength": 300
          },
          "assetIds": {
            "type": "array",
            "maxItems": 10,
            "items": {
              "type": "string",
              "format": "uuid"
            }
          },
          "sourceIds": {
            "type": "array",
            "maxItems": 10,
            "items": {
              "type": "string",
              "format": "uuid"
            }
          }
        }
      }
    },
    "structure": {
      "type": "array",
      "minItems": 3,
      "maxItems": 20,
      "items": {
        "type": "object",
        "additionalProperties": false,
        "required": [
          "id",
          "heading",
          "purpose",
          "keyPointIndexes"
        ],
        "properties": {
          "id": {
            "type": "string",
            "pattern": "^[a-z0-9_-]{1,40}$"
          },
          "heading": {
            "type": "string",
            "maxLength": 200
          },
          "purpose": {
            "type": "string",
            "maxLength": 500
          },
          "keyPointIndexes": {
            "type": "array",
            "items": {
              "type": "integer",
              "minimum": 0
            },
            "uniqueItems": true
          }
        }
      }
    },
    "mustUseAssets": {
      "type": "array",
      "minItems": 1,
      "maxItems": 20,
      "items": {
        "type": "string",
        "format": "uuid"
      },
      "uniqueItems": true
    },
    "mustAvoid": {
      "type": "array",
      "maxItems": 50,
      "items": {
        "type": "string",
        "maxLength": 300
      }
    },
    "claimPlan": {
      "type": "array",
      "maxItems": 30,
      "items": {
        "type": "object",
        "additionalProperties": false,
        "required": [
          "claimType",
          "plannedClaim",
          "requiredSourceIds"
        ],
        "properties": {
          "claimType": {
            "enum": [
              "external_fact",
              "personal_experience",
              "opinion",
              "inference",
              "recommendation",
              "quote"
            ]
          },
          "plannedClaim": {
            "type": "string",
            "maxLength": 500
          },
          "requiredSourceIds": {
            "type": "array",
            "maxItems": 10,
            "items": {
              "type": "string",
              "format": "uuid"
            }
          }
        }
      }
    },
    "formatPlans": {
      "type": "object",
      "additionalProperties": false,
      "properties": {
        "masterArticle": {
          "$ref": "#/$defs/formatPlan"
        },
        "videoScript": {
          "$ref": "#/$defs/formatPlan"
        },
        "carousel": {
          "$ref": "#/$defs/formatPlan"
        },
        "shortVideos": {
          "$ref": "#/$defs/formatPlan"
        },
        "microPosts": {
          "$ref": "#/$defs/formatPlan"
        },
        "shotList": {
          "$ref": "#/$defs/formatPlan"
        }
      },
      "minProperties": 1
    },
    "knownLimitations": {
      "type": "array",
      "maxItems": 20,
      "items": {
        "type": "string",
        "maxLength": 500
      }
    },
    "artifact": {
      "type": "object",
      "additionalProperties": false,
      "required": [
        "type",
        "rationale",
        "userValue"
      ],
      "properties": {
        "type": {
          "enum": [
            "none",
            "calculator",
            "quiz",
            "checklist"
          ]
        },
        "rationale": {
          "type": "string",
          "maxLength": 500
        },
        "userValue": {
          "type": "string",
          "maxLength": 500
        }
      }
    }
  },
  "$defs": {
    "formatPlan": {
      "type": "object",
      "additionalProperties": false,
      "required": [
        "enabled",
        "purpose",
        "audienceAction",
        "constraints"
      ],
      "properties": {
        "enabled": {
          "type": "boolean"
        },
        "purpose": {
          "type": "string",
          "maxLength": 500
        },
        "audienceAction": {
          "type": "string",
          "maxLength": 300
        },
        "constraints": {
          "type": "array",
          "maxItems": 20,
          "items": {
            "type": "string",
            "maxLength": 300
          }
        }
      }
    }
  }
}
